{
  "schemaVersion": "velox.bench-result/v2",
  "suite": "zero-cache",
  "framework": "wails",
  "frameworkRevision": "2e3e15359106686c1f9e5c11b7a84025169cea5d",
  "sample": 2,
  "fixture": {
    "name": "hello",
    "sha256": "e50cd76355a78801ce1208d21ff9355f793a3baae8fa8a0cf3a47b37d7662c35",
    "generatedFiles": 0,
    "generatedBytes": 0
  },
  "outcome": "success",
  "startedAtUtc": "2026-09-23T12:01:46.306Z",
  "finishedAtUtc": "2026-09-23T12:03:16.099Z",
  "environment": {
    "runner": "windows-2025",
    "runnerImageVersion": "20260907.229.1",
    "os": "windows",
    "architecture": "amd64",
    "windowsVersion": "10.0.26100",
    "cpuModel": "AMD EPYC 7763 64-Core Processor",
    "logicalProcessors": 4,
    "memoryBytes": 17174360064,
    "bunVersion": "1.3.14",
    "repositoryCommit": "37e631c79167640eb0689683abc20c9bbc88983d",
    "runId": "35857882389",
    "runAttempt": "1"
  },
  "measurement": {
    "endToEndMs": 89793,
    "frameworkSetupMs": 57968.35509999999,
    "buildMs": 4060.485400000005,
    "packageMs": 294.6258999999991,
    "acquisitionWorkingSetBytes": 941623449,
    "outputFiles": 1,
    "outputBytes": 9748992,
    "outputArchiveBytes": 9749138,
    "outputArchiveSha256": "2b81e12851183d6a620cc725aae6b4a853bc3bdaeb3f37b68122a3e014818105",
    "intermediateFiles": 26961,
    "intermediateBytes": 941626538,
    "uploadedCacheBytes": 0,
    "cacheEvidence": "workflow-source-audit"
  },
  "failure": null
}
